{
  "schema_version": "market-thesis.v1",
  "kind": "market_thesis",
  "id": "thesis-btc-2026-09-29",
  "revision": 1,
  "workflow_state": "artifact_saved",
  "asset": {
    "asset_id": "BTC",
    "symbol": "BTC"
  },
  "user_belief": {
    "source": "user",
    "direction": "long",
    "statement": "BTC trades higher over the next quarter.",
    "magnitude": {
      "kind": "percent_move",
      "percent_move": 15
    },
    "uncertainty": {
      "kind": "wider_than_market"
    },
    "assumptions": [
      {
        "id": "a1",
        "text": "No change to the listed-expiry set."
      }
    ]
  },
  "horizon": {
    "mode": "listed_expiry",
    "target_date": "2026-09-25"
  },
  "market_evidence": {
    "citations": [
      {
        "citation_id": "omr-btc",
        "primitive": "options_market_read",
        "endpoint": "/v1/options-market-read",
        "as_of_utc": "2026-09-29T17:00:00Z",
        "request": {
          "asset_id": "BTC",
          "expiry_date": "2026-09-25"
        },
        "schema_version": "1.3",
        "ruleset_version": "options-market-read.v1.3",
        "payload": {
          "schema_version": "1.3",
          "ruleset_version": "options-market-read.v1.3",
          "metrics": {
            "middle_50_range": {
              "low": 85000,
              "high": 128000
            }
          }
        },
        "payload_sha256": "e18a5ea51bc6b9212589dd113ee2ac1ccce1272579cec74120238e6c65a34314"
      },
      {
        "citation_id": "horizon-btc",
        "primitive": "options_horizon_comparison",
        "endpoint": "/ppe-display-api/horizon/comparison.json",
        "as_of_utc": "2026-09-29T17:00:00Z",
        "request": {
          "asset_id": "BTC",
          "target_bucket_days": 90
        },
        "payload": {
          "kind": "options_horizon_comparison",
          "one_sigma_move_usd": 18000
        },
        "payload_sha256": "d3403cbf6e6f704fc62f90872066eb8d72a6b6fd6bad9a23d46ea73e51d56b49"
      }
    ]
  },
  "disagreement": {
    "method": "belief_vs_cited_evidence.v1",
    "user_side": [
      "magnitude",
      "uncertainty"
    ],
    "market_side_citation_id": "omr-btc",
    "summary": "User belief magnitude is percent move and uncertainty is wider than market. Market citation omr-btc (options_market_read) reports middle 50 range 85000 to 128000. Descriptive comparison only.",
    "read_only": true
  },
  "expression_comparison": {
    "ranking_kind": "options_expression_fit_ranking",
    "recommendation_status": "educational_fit_not_recommendation",
    "preferences": {
      "direction": "long",
      "belief": "BTC trades higher over the next quarter.",
      "max_loss_usd": 500,
      "payoff_preference": "defined_risk"
    },
    "ranking_payload": {
      "kind": "options_expression_fit_ranking",
      "recommendation_status": "educational_fit_not_recommendation",
      "preferences": {
        "direction": "long",
        "belief": "BTC trades higher over the next quarter."
      },
      "exposure_paths": [
        {
          "path_id": "defined-risk-call-spread",
          "label": "Defined-risk call spread",
          "cost_hint_usd": 250,
          "capital_shape": "Capped upside with the debit as the amount at risk"
        }
      ]
    },
    "rows": [
      {
        "candidate_id": "exposure:defined-risk-call-spread",
        "label": "Defined-risk call spread",
        "source_primitive": "exposure_paths",
        "cost": {
          "status": "estimated",
          "amount_usd": 250,
          "label": "debit"
        },
        "max_loss": {
          "status": "estimated",
          "amount_usd": 250,
          "label": "premium paid",
          "bounded": true
        },
        "time_horizon": {
          "label": "about 90 days",
          "days": 90
        },
        "payoff_shape": "Capped upside with the debit as the amount at risk",
        "failure_modes": [
          "The debit can expire worthless if BTC does not reach the spread."
        ],
        "recommendation_status": "educational_fit_not_recommendation",
        "rank": 1,
        "score": 72.5
      }
    ]
  },
  "artifact": {
    "frozen_at_utc": "2026-09-29T18:00:00Z",
    "content_sha256": "c51e901b9294222fbd0dabed5058b7574bdadd768db30cad5a81f47a7d1c893a",
    "shareable": true,
    "execution": "out_of_scope"
  },
  "prior_artifacts": [],
  "links": {},
  "authority": {
    "execution": "out_of_scope",
    "recommendation_status": "educational_comparison_not_recommendation"
  }
}
